[{"id":"legacy-fixation-guide-v3-fixation-v3-7-c005c83b35f8","status":"scientific_review","access":"sample","certification_scope":"HT_HTL","domain":"fixation","topic":"fixation_artifacts","difficulty":"foundational","cognitive_level":"recall","stem":"Mercury pigment is classically removed with:","options":[{"id":"A","text":"Iodine then sodium thiosulfate"},{"id":"B","text":"Acid alcohol then bluing"},{"id":"C","text":"Hydrogen peroxide only"},{"id":"D","text":"Xylene then paraffin"}],"correct_option_id":"A","rationale":"Iodine followed by sodium thiosulfate is the classic mercury-pigment removal sequence.","distractor_rationales":{"B":"Acid alcohol and bluing are used in hematoxylin differentiation and bluing, not mercury-pigment removal.","C":"Hydrogen peroxide may bleach some pigments but is not the classic mercury-removal sequence.","D":"Xylene and paraffin are processing reagents and do not chemically remove mercury pigment."},"learning_objective":"Identify the classic reagent sequence used to remove mercury pigment.","lesson_refs":["fixation-v3"],"references":[{"label":"Reviewed FHL Fixation lesson","locator":"modules/fixation-guide-v3.html#quiz-7","notes":"Stem, options, key, and correct-answer explanation preserved from the reviewed learner-facing quiz."},{"label":"FHL module authority record","locator":"data/module-authority.json#modules.fixation-v3","notes":"Lists the module review date, exam alignment, and supporting histotechnology references."}],"review":{"scientific":{"status":"pending","reviewer":null,"reviewed_at":null,"notes":"Complete rationales authored; final qualified reviewer approval required."},"editorial":{"status":"pending","reviewer":null,"reviewed_at":null,"notes":"Ready for controlled editorial review after scientific approval."}},"version":1,"created_at":"2026-08-02T21:25:00Z","updated_at":"2026-08-02T21:25:00Z"}]