[{"id":"legacy-fixation-guide-v3-fixation-v3-6-700b0fa0a2cd","status":"scientific_review","access":"sample","certification_scope":"HT_HTL","domain":"fixation","topic":"fixation_time_and_volume","difficulty":"foundational","cognitive_level":"recall","stem":"A commonly taught minimum fixative-to-tissue volume is:","options":[{"id":"A","text":"1:10"},{"id":"B","text":"1:1"},{"id":"C","text":"10:1"},{"id":"D","text":"100:1 for every specimen"}],"correct_option_id":"C","rationale":"A generous fixative volume, often around 10:1, helps prevent depletion and dilution.","distractor_rationales":{"A":"A 1:10 ratio reverses the intended relationship and provides too little fixative for the tissue volume.","B":"A 1:1 ratio is generally inadequate because tissue can deplete or dilute the fixative.","D":"A 100:1 ratio may be used in special circumstances but is not the commonly taught routine minimum for every specimen."},"learning_objective":"Recall the commonly taught approximate fixative-to-tissue volume used for routine fixation.","lesson_refs":["fixation-v3"],"references":[{"label":"Reviewed FHL Fixation lesson","locator":"modules/fixation-guide-v3.html#quiz-6","notes":"Stem, options, key, and correct-answer explanation preserved from the reviewed learner-facing quiz."},{"label":"FHL module authority record","locator":"data/module-authority.json#modules.fixation-v3","notes":"Lists the module review date, exam alignment, and supporting histotechnology references."}],"review":{"scientific":{"status":"pending","reviewer":null,"reviewed_at":null,"notes":"Complete rationales authored; final qualified reviewer approval required."},"editorial":{"status":"pending","reviewer":null,"reviewed_at":null,"notes":"Ready for controlled editorial review after scientific approval."}},"version":1,"created_at":"2026-08-02T21:25:00Z","updated_at":"2026-08-02T21:25:00Z"}]