[{"id":"legacy-fixation-guide-v3-fixation-v3-4-69f195d85eb4","status":"scientific_review","access":"sample","certification_scope":"HT_HTL","domain":"fixation","topic":"decalcification","difficulty":"applied","cognitive_level":"application","stem":"Preferred decalcifier for an IHC/ISH-heavy bone specimen:","options":[{"id":"A","text":"Concentrated nitric acid"},{"id":"B","text":"Hydrochloric acid without validation"},{"id":"C","text":"Picric acid"},{"id":"D","text":"EDTA"}],"correct_option_id":"D","rationale":"EDTA is slower but generally preserves antigens and nucleic acids better than strong mineral acids.","distractor_rationales":{"A":"Concentrated nitric acid decalcifies rapidly but can damage morphology, antigens, and nucleic acids.","B":"Unvalidated hydrochloric acid may impair IHC and ISH targets and is not the preferred choice here.","C":"Picric acid is not the routine preferred decalcifier when preservation of antigens and nucleic acids is the priority."},"learning_objective":"Select a decalcification method that better preserves antigens and nucleic acids for IHC and ISH.","lesson_refs":["fixation-v3"],"references":[{"label":"Reviewed FHL Fixation lesson","locator":"modules/fixation-guide-v3.html#quiz-4","notes":"Stem, options, key, and correct-answer explanation preserved from the reviewed learner-facing quiz."},{"label":"FHL module authority record","locator":"data/module-authority.json#modules.fixation-v3","notes":"Lists the module review date, exam alignment, and supporting histotechnology references."}],"review":{"scientific":{"status":"pending","reviewer":null,"reviewed_at":null,"notes":"Complete rationales authored; final qualified reviewer approval required."},"editorial":{"status":"pending","reviewer":null,"reviewed_at":null,"notes":"Ready for controlled editorial review after scientific approval."}},"version":1,"created_at":"2026-08-02T21:25:00Z","updated_at":"2026-08-02T21:25:00Z"}]