[{"id":"legacy-fixation-guide-v3-fixation-v3-1-f0faf8851500","status":"scientific_review","access":"sample","certification_scope":"HT_HTL","domain":"fixation","topic":"fixation_mechanisms","difficulty":"foundational","cognitive_level":"recall","stem":"Routine 10% neutral buffered formalin contains approximately:","options":[{"id":"A","text":"1% formaldehyde"},{"id":"B","text":"4% formaldehyde"},{"id":"C","text":"10% formaldehyde"},{"id":"D","text":"40% formaldehyde"}],"correct_option_id":"B","rationale":"Routine 10% NBF contains approximately 4% formaldehyde.","distractor_rationales":{"A":"One percent formaldehyde is below the usual concentration in routine 10% neutral buffered formalin.","C":"The 10% label refers to the dilution of commercial formalin, not the final formaldehyde concentration.","D":"Approximately 40% formaldehyde describes concentrated stock formalin rather than the routine working fixative."},"learning_objective":"Recognize the approximate formaldehyde concentration in routine 10% neutral buffered formalin.","lesson_refs":["fixation-v3"],"references":[{"label":"Reviewed FHL Fixation lesson","locator":"modules/fixation-guide-v3.html#quiz-1","notes":"Stem, options, key, and correct-answer explanation preserved from the reviewed learner-facing quiz."},{"label":"FHL module authority record","locator":"data/module-authority.json#modules.fixation-v3","notes":"Lists the module review date, exam alignment, and supporting histotechnology references."}],"review":{"scientific":{"status":"pending","reviewer":null,"reviewed_at":null,"notes":"Complete rationales authored; final qualified reviewer approval required."},"editorial":{"status":"pending","reviewer":null,"reviewed_at":null,"notes":"Ready for controlled editorial review after scientific approval."}},"version":1,"created_at":"2026-08-02T21:25:00Z","updated_at":"2026-08-02T21:25:00Z"}]