[{"id":"legacy-fixation-guide-v3-fixation-v3-5-e266aa829f16","status":"scientific_review","access":"sample","certification_scope":"HT_HTL","domain":"fixation","topic":"fixation_artifacts","difficulty":"foundational","cognitive_level":"recall","stem":"Brown-black pigment associated with acidic formalin is:","options":[{"id":"A","text":"Hemosiderin"},{"id":"B","text":"Formalin hematin"},{"id":"C","text":"Melanin"},{"id":"D","text":"Carbon"}],"correct_option_id":"B","rationale":"Acid formalin hematin forms in acidic formalin, especially in blood-rich tissue.","distractor_rationales":{"A":"Hemosiderin is an iron-storage pigment and is not produced by acidic formalin.","C":"Melanin is an endogenous pigment and is not the brown-black artifact formed by acidic formalin.","D":"Carbon is an exogenous pigment and is unrelated to formalin hematin formation."},"learning_objective":"Recognize formalin hematin as the brown-black pigment associated with acidic formalin.","lesson_refs":["fixation-v3"],"references":[{"label":"Reviewed FHL Fixation lesson","locator":"modules/fixation-guide-v3.html#quiz-5","notes":"Stem, options, key, and correct-answer explanation preserved from the reviewed learner-facing quiz."},{"label":"FHL module authority record","locator":"data/module-authority.json#modules.fixation-v3","notes":"Lists the module review date, exam alignment, and supporting histotechnology references."}],"review":{"scientific":{"status":"pending","reviewer":null,"reviewed_at":null,"notes":"Complete rationales authored; final qualified reviewer approval required."},"editorial":{"status":"pending","reviewer":null,"reviewed_at":null,"notes":"Ready for controlled editorial review after scientific approval."}},"version":1,"created_at":"2026-08-02T21:25:00Z","updated_at":"2026-08-02T21:25:00Z"}]