[{"id":"legacy-fixation-guide-v3-fixation-v3-3-79d7ffc2755b","status":"scientific_review","access":"sample","certification_scope":"HT_HTL","domain":"fixation","topic":"fixation_mechanisms","difficulty":"foundational","cognitive_level":"recall","stem":"The main action of formaldehyde is:","options":[{"id":"A","text":"Protein crosslinking"},{"id":"B","text":"Complete lipid preservation"},{"id":"C","text":"Calcium removal"},{"id":"D","text":"Paraffin infiltration"}],"correct_option_id":"A","rationale":"Formaldehyde primarily stabilizes proteins through crosslink formation.","distractor_rationales":{"B":"Routine formaldehyde does not completely preserve lipids; many lipids are extracted during processing.","C":"Calcium removal is performed by decalcifying agents rather than by formaldehyde fixation.","D":"Paraffin infiltration occurs during tissue processing after fixation and clearing."},"learning_objective":"Identify protein crosslinking as the principal fixation mechanism of formaldehyde.","lesson_refs":["fixation-v3"],"references":[{"label":"Reviewed FHL Fixation lesson","locator":"modules/fixation-guide-v3.html#quiz-3","notes":"Stem, options, key, and correct-answer explanation preserved from the reviewed learner-facing quiz."},{"label":"FHL module authority record","locator":"data/module-authority.json#modules.fixation-v3","notes":"Lists the module review date, exam alignment, and supporting histotechnology references."}],"review":{"scientific":{"status":"pending","reviewer":null,"reviewed_at":null,"notes":"Complete rationales authored; final qualified reviewer approval required."},"editorial":{"status":"pending","reviewer":null,"reviewed_at":null,"notes":"Ready for controlled editorial review after scientific approval."}},"version":1,"created_at":"2026-08-02T21:25:00Z","updated_at":"2026-08-02T21:25:00Z"}]