[{"id":"legacy-fixation-guide-v3-fixation-v3-2-168f3a26042e","status":"scientific_review","access":"sample","certification_scope":"HT_HTL","domain":"fixation","topic":"tissue_handling","difficulty":"applied","cognitive_level":"analysis","stem":"Preserved edges with an autolyzed center most strongly suggests:","options":[{"id":"A","text":"Excess bluing"},{"id":"B","text":"A dull microtome blade"},{"id":"C","text":"Excess specimen thickness"},{"id":"D","text":"Coverslip bubbles"}],"correct_option_id":"C","rationale":"A thick specimen fixes from the surface inward and may remain underfixed centrally.","distractor_rationales":{"A":"Bluing affects hematoxylin color and does not create central autolysis with preserved tissue edges.","B":"A dull microtome blade produces sectioning artifacts after processing, not an underfixed specimen center.","D":"Coverslip bubbles are mounting artifacts and do not explain autolysis within the tissue block."},"learning_objective":"Identify excessive specimen thickness from the pattern of preserved edges and central autolysis.","lesson_refs":["fixation-v3"],"references":[{"label":"Reviewed FHL Fixation lesson","locator":"modules/fixation-guide-v3.html#quiz-2","notes":"Stem, options, key, and correct-answer explanation preserved from the reviewed learner-facing quiz."},{"label":"FHL module authority record","locator":"data/module-authority.json#modules.fixation-v3","notes":"Lists the module review date, exam alignment, and supporting histotechnology references."}],"review":{"scientific":{"status":"pending","reviewer":null,"reviewed_at":null,"notes":"Complete rationales authored; final qualified reviewer approval required."},"editorial":{"status":"pending","reviewer":null,"reviewed_at":null,"notes":"Ready for controlled editorial review after scientific approval."}},"version":1,"created_at":"2026-08-02T21:25:00Z","updated_at":"2026-08-02T21:25:00Z"}]