[{"id":"legacy-fixation-guide-v3-fixation-v3-9-266ecda712c7","status":"scientific_review","access":"sample","certification_scope":"HT_HTL","domain":"fixation","topic":"fixative_selection","difficulty":"foundational","cognitive_level":"recall","stem":"A major limitation of glutaraldehyde is:","options":[{"id":"A","text":"It never crosslinks protein"},{"id":"B","text":"Slow penetration and strong crosslinking"},{"id":"C","text":"It dissolves all paraffin"},{"id":"D","text":"It is a decalcifier"}],"correct_option_id":"B","rationale":"Glutaraldehyde preserves ultrastructure well but penetrates slowly and can increase autofluorescence.","distractor_rationales":{"A":"Glutaraldehyde is a strong protein crosslinker, so failure to crosslink is not its limitation.","C":"Glutaraldehyde does not dissolve paraffin; paraffin removal is accomplished with deparaffinizing solvents.","D":"Glutaraldehyde is a fixative rather than a decalcifying agent."},"learning_objective":"Recognize slow penetration and strong crosslinking as major limitations of glutaraldehyde.","lesson_refs":["fixation-v3"],"references":[{"label":"Reviewed FHL Fixation lesson","locator":"modules/fixation-guide-v3.html#quiz-9","notes":"Stem, options, key, and correct-answer explanation preserved from the reviewed learner-facing quiz."},{"label":"FHL module authority record","locator":"data/module-authority.json#modules.fixation-v3","notes":"Lists the module review date, exam alignment, and supporting histotechnology references."}],"review":{"scientific":{"status":"pending","reviewer":null,"reviewed_at":null,"notes":"Complete rationales authored; final qualified reviewer approval required."},"editorial":{"status":"pending","reviewer":null,"reviewed_at":null,"notes":"Ready for controlled editorial review after scientific approval."}},"version":1,"created_at":"2026-08-02T21:25:00Z","updated_at":"2026-08-02T21:25:00Z"}]