[{"id":"legacy-fixation-guide-v3-fixation-v3-8-86a2b18646f6","status":"scientific_review","access":"sample","certification_scope":"HT_HTL","domain":"fixation","topic":"tissue_handling","difficulty":"advanced","cognitive_level":"analysis","stem":"Best response to variable IHC caused by inconsistent fixation:","options":[{"id":"A","text":"Always double antibody concentration"},{"id":"B","text":"Always use the highest-pH retrieval"},{"id":"C","text":"Ignore fixation if the positive control stains"},{"id":"D","text":"Standardize preanalytics and validate retrieval"}],"correct_option_id":"D","rationale":"Preanalytic variables and assay controls must be standardized; retrieval cannot reliably reverse every fixation problem.","distractor_rationales":{"A":"Increasing antibody concentration cannot correct the variable target preservation caused by inconsistent fixation.","B":"Using the highest-pH retrieval for every assay is not evidence-based and can damage tissue or increase background.","C":"A staining positive control does not eliminate the effect of specimen-specific preanalytic variation."},"learning_objective":"Select the best corrective strategy when inconsistent fixation produces variable IHC results.","lesson_refs":["fixation-v3"],"references":[{"label":"Reviewed FHL Fixation lesson","locator":"modules/fixation-guide-v3.html#quiz-8","notes":"Stem, options, key, and correct-answer explanation preserved from the reviewed learner-facing quiz."},{"label":"FHL module authority record","locator":"data/module-authority.json#modules.fixation-v3","notes":"Lists the module review date, exam alignment, and supporting histotechnology references."}],"review":{"scientific":{"status":"pending","reviewer":null,"reviewed_at":null,"notes":"Complete rationales authored; final qualified reviewer approval required."},"editorial":{"status":"pending","reviewer":null,"reviewed_at":null,"notes":"Ready for controlled editorial review after scientific approval."}},"version":1,"created_at":"2026-08-02T21:25:00Z","updated_at":"2026-08-02T21:25:00Z"}]