[{"id":"legacy-fixation-guide-v3-fixation-v3-10-3393091b9c66","status":"scientific_review","access":"sample","certification_scope":"HT_HTL","domain":"fixation","topic":"tissue_handling","difficulty":"applied","cognitive_level":"application","stem":"A specimen arrives after a major fixation delay. The best action is to:","options":[{"id":"A","text":"Hide the delay"},{"id":"B","text":"Extend every stain automatically"},{"id":"C","text":"Document and escalate the deviation per SOP"},{"id":"D","text":"Discard it without authorization"}],"correct_option_id":"C","rationale":"Documenting the deviation and following the laboratory escalation process protects interpretation and quality.","distractor_rationales":{"A":"Concealing a fixation delay prevents appropriate interpretation and violates quality documentation principles.","B":"Automatically extending every stain is not a validated correction for delayed fixation and may create new artifacts.","D":"Specimens should not be discarded without following authorization, documentation, and laboratory policy."},"learning_objective":"Apply documentation and escalation requirements when a specimen has a major fixation delay.","lesson_refs":["fixation-v3"],"references":[{"label":"Reviewed FHL Fixation lesson","locator":"modules/fixation-guide-v3.html#quiz-10","notes":"Stem, options, key, and correct-answer explanation preserved from the reviewed learner-facing quiz."},{"label":"FHL module authority record","locator":"data/module-authority.json#modules.fixation-v3","notes":"Lists the module review date, exam alignment, and supporting histotechnology references."}],"review":{"scientific":{"status":"pending","reviewer":null,"reviewed_at":null,"notes":"Complete rationales authored; final qualified reviewer approval required."},"editorial":{"status":"pending","reviewer":null,"reviewed_at":null,"notes":"Ready for controlled editorial review after scientific approval."}},"version":1,"created_at":"2026-08-02T21:25:00Z","updated_at":"2026-08-02T21:25:00Z"}]